{
  "schemaVersion": 1,
  "catalogId": "example-agent-skills",
  "catalogSha256": "aaaaaaaaaaaaaaaaaaaaaaaaaaaaaaaaaaaaaaaaaaaaaaaaaaaaaaaaaaaaaaaa",
  "sources": [
    {
      "id": "agent-skills",
      "repository": "https://github.com/example/agent-skills-catalog.git",
      "requestedRef": "main",
      "requestedRefType": "branch",
      "resolvedCommit": "main",
      "resolvedVersion": "unresolved",
      "archiveSha256": "bbbbbbbbbbbbbbbbbbbbbbbbbbbbbbbbbbbbbbbbbbbbbbbbbbbbbbbbbbbbbbbb"
    }
  ],
  "skills": []
}
