{
  "schemaVersion": 1,
  "catalogId": "example-agent-skills",
  "catalogSha256": "6eef6039c1e944f94ac8322e1f7002f846040d157eb13601045dd78243e3a71a",
  "sources": [
    {
      "id": "agent-skills",
      "repository": "https://github.com/example/agent-skills-catalog.git",
      "requestedRef": "v1.0.0",
      "requestedRefType": "tag",
      "resolvedCommit": "0123456789abcdef0123456789abcdef01234567",
      "resolvedVersion": "1.0.0",
      "archiveSha256": "bbbbbbbbbbbbbbbbbbbbbbbbbbbbbbbbbbbbbbbbbbbbbbbbbbbbbbbbbbbbbbbb"
    }
  ],
  "skills": [
    {
      "id": "capture-private-course-knowledge",
      "sourceId": "agent-skills",
      "sourcePath": ".agents/skills/capture-private-course-knowledge",
      "contentSha256": "1111111111111111111111111111111111111111111111111111111111111111"
    },
    {
      "id": "configure-bitbucket-api-access",
      "sourceId": "agent-skills",
      "sourcePath": ".agents/skills/configure-bitbucket-api-access",
      "contentSha256": "2222222222222222222222222222222222222222222222222222222222222222"
    },
    {
      "id": "configure-confluence-api-access",
      "sourceId": "agent-skills",
      "sourcePath": ".agents/skills/configure-confluence-api-access",
      "contentSha256": "3333333333333333333333333333333333333333333333333333333333333333"
    },
    {
      "id": "configure-jira-api-access",
      "sourceId": "agent-skills",
      "sourcePath": ".agents/skills/configure-jira-api-access",
      "contentSha256": "4444444444444444444444444444444444444444444444444444444444444444"
    },
    {
      "id": "investigate-datadog-logs",
      "sourceId": "agent-skills",
      "sourcePath": ".agents/skills/investigate-datadog-logs",
      "contentSha256": "5555555555555555555555555555555555555555555555555555555555555555"
    },
    {
      "id": "manage-ai-memory",
      "sourceId": "agent-skills",
      "sourcePath": ".agents/skills/manage-ai-memory",
      "contentSha256": "9999999999999999999999999999999999999999999999999999999999999999"
    },
    {
      "id": "manage-confluence-docs-as-code",
      "sourceId": "agent-skills",
      "sourcePath": ".agents/skills/manage-confluence-docs-as-code",
      "contentSha256": "eeeeeeeeeeeeeeeeeeeeeeeeeeeeeeeeeeeeeeeeeeeeeeeeeeeeeeeeeeeeeeee"
    },
    {
      "id": "manage-task-handoff",
      "sourceId": "agent-skills",
      "sourcePath": ".agents/skills/manage-task-handoff",
      "contentSha256": "aaaaaaaaaaaaaaaaaaaaaaaaaaaaaaaaaaaaaaaaaaaaaaaaaaaaaaaaaaaaaaaa"
    },
    {
      "id": "operate-environment-authorized-sql",
      "sourceId": "agent-skills",
      "sourcePath": ".agents/skills/operate-environment-authorized-sql",
      "contentSha256": "1111111111111111111111111111111111111111111111111111111111111111"
    },
    {
      "id": "plan-production-change",
      "sourceId": "agent-skills",
      "sourcePath": ".agents/skills/plan-production-change",
      "contentSha256": "6666666666666666666666666666666666666666666666666666666666666666"
    },
    {
      "id": "publish-requirements-to-confluence",
      "sourceId": "agent-skills",
      "sourcePath": ".agents/skills/publish-requirements-to-confluence",
      "contentSha256": "7777777777777777777777777777777777777777777777777777777777777777"
    },
    {
      "id": "review-bitbucket-pull-request",
      "sourceId": "agent-skills",
      "sourcePath": ".agents/skills/review-bitbucket-pull-request",
      "contentSha256": "8888888888888888888888888888888888888888888888888888888888888888"
    },
    {
      "id": "verify-data-access-performance",
      "sourceId": "agent-skills",
      "sourcePath": ".agents/skills/verify-data-access-performance",
      "contentSha256": "aaaaaaaaaaaaaaaaaaaaaaaaaaaaaaaaaaaaaaaaaaaaaaaaaaaaaaaaaaaaaaaa"
    },
    {
      "id": "work-with-jira",
      "sourceId": "agent-skills",
      "sourcePath": ".agents/skills/work-with-jira",
      "contentSha256": "bbbbbbbbbbbbbbbbbbbbbbbbbbbbbbbbbbbbbbbbbbbbbbbbbbbbbbbbbbbbbbbb"
    },
    {
      "id": "write-copilot-implementation-prompt",
      "sourceId": "agent-skills",
      "sourcePath": ".agents/skills/write-copilot-implementation-prompt",
      "contentSha256": "cccccccccccccccccccccccccccccccccccccccccccccccccccccccccccccccc"
    }
  ]
}
